{
  "schema_version": "rods_validated_candidate.v1",
  "candidate_id": "candidate_de76da84e46a570004b12703",
  "validated": true,
  "validation": {
    "passed": true,
    "deterministic_gates": [
      {
        "name": "category_validity_gate",
        "passed": true,
        "detail": "category protocol and measured exposure passed",
        "metadata": {
          "data_type": "multi_turn_base",
          "final_turn_count": 4
        }
      },
      {
        "name": "unit_semantic_gate",
        "passed": true,
        "detail": "all explicit unit-bearing GT quantities are compatible with audited contracts",
        "metadata": {
          "source_status": "PROJECT_UNIT_SEMANTIC_GUARD",
          "checks": [],
          "failures": [],
          "catalog_audit": [
            {
              "function": "adjustClimateControl",
              "parameter": "temperature",
              "dimension": "temperature",
              "canonical_unit": "celsius",
              "status": "AUDITED_STATIC",
              "evidence": "schema argument unit; explicit unit argument='celsius'",
              "schema_description": "The temperature to set in degree. Default to be celsius.",
              "source_status": "PROJECT_UNIT_SEMANTIC_GUARD"
            },
            {
              "function": "compute_exchange_rate",
              "parameter": "value",
              "dimension": "DYNAMIC",
              "canonical_unit": "DYNAMIC_FROM_SCHEMA_ARGUMENT",
              "status": "AUDITED_DYNAMIC",
              "evidence": "('base_currency', None)",
              "schema_description": "The value to convert",
              "source_status": "PROJECT_UNIT_SEMANTIC_GUARD"
            },
            {
              "function": "estimate_drive_feasibility_by_mileage",
              "parameter": "distance",
              "dimension": "distance",
              "canonical_unit": "mile",
              "status": "AUDITED_STATIC",
              "evidence": "schema: distance to travel in miles",
              "schema_description": "The distance to travel in miles.",
              "source_status": "PROJECT_UNIT_SEMANTIC_GUARD"
            },
            {
              "function": "fillFuelTank",
              "parameter": "fuelAmount",
              "dimension": "volume",
              "canonical_unit": "gallon",
              "status": "AUDITED_STATIC",
              "evidence": "schema: amount of fuel to fill in gallons",
              "schema_description": "The amount of fuel to fill in gallons; this is the additional fuel to add to the tank.",
              "source_status": "PROJECT_UNIT_SEMANTIC_GUARD"
            },
            {
              "function": "gallon_to_liter",
              "parameter": "gallon",
              "dimension": "volume",
              "canonical_unit": "gallon",
              "status": "AUDITED_STATIC",
              "evidence": "schema/public implementation: amount of gallon",
              "schema_description": "The amount of gallon to convert.",
              "source_status": "PROJECT_UNIT_SEMANTIC_GUARD"
            },
            {
              "function": "imperial_si_conversion",
              "parameter": "value",
              "dimension": "DYNAMIC",
              "canonical_unit": "DYNAMIC_FROM_SCHEMA_ARGUMENT",
              "status": "AUDITED_DYNAMIC",
              "evidence": "('unit_in', None)",
              "schema_description": "Value to be converted.",
              "source_status": "PROJECT_UNIT_SEMANTIC_GUARD"
            },
            {
              "function": "liter_to_gallon",
              "parameter": "liter",
              "dimension": "volume",
              "canonical_unit": "liter",
              "status": "AUDITED_STATIC",
              "evidence": "schema/public implementation: amount of liter",
              "schema_description": "The amount of liter to convert.",
              "source_status": "PROJECT_UNIT_SEMANTIC_GUARD"
            },
            {
              "function": "notify_price_change",
              "parameter": "threshold",
              "dimension": "ratio",
              "canonical_unit": "percent",
              "status": "AUDITED_STATIC",
              "evidence": "schema: percentage change threshold",
              "schema_description": "Percentage change threshold to trigger a notification. ",
              "source_status": "PROJECT_UNIT_SEMANTIC_GUARD"
            },
            {
              "function": "setCruiseControl",
              "parameter": "speed",
              "dimension": "UNIT_UNKNOWN",
              "canonical_unit": "UNIT_UNKNOWN",
              "status": "UNIT_UNKNOWN",
              "evidence": "schema token 'm/h' is ambiguous; no unit guessed",
              "schema_description": "The speed to set in m/h. The speed should be between 0 and 120 and a multiple of 5.",
              "source_status": "PROJECT_UNIT_SEMANTIC_GUARD"
            },
            {
              "function": "setCruiseControl",
              "parameter": "distanceToNextVehicle",
              "dimension": "distance",
              "canonical_unit": "meter",
              "status": "AUDITED_STATIC",
              "evidence": "schema: distance to the next vehicle in meters",
              "schema_description": "The distance to the next vehicle in meters.",
              "source_status": "PROJECT_UNIT_SEMANTIC_GUARD"
            },
            {
              "function": "set_budget_limit",
              "parameter": "budget_limit",
              "dimension": "currency",
              "canonical_unit": "usd",
              "status": "AUDITED_STATIC",
              "evidence": "schema: budget limit in USD",
              "schema_description": "The budget limit to set in USD",
              "source_status": "PROJECT_UNIT_SEMANTIC_GUARD"
            },
            {
              "function": "si_unit_conversion",
              "parameter": "value",
              "dimension": "DYNAMIC",
              "canonical_unit": "DYNAMIC_FROM_SCHEMA_ARGUMENT",
              "status": "AUDITED_DYNAMIC",
              "evidence": "('unit_in', None)",
              "schema_description": "Value to be converted.",
              "source_status": "PROJECT_UNIT_SEMANTIC_GUARD"
            }
          ],
          "gt_rewritten": false
        }
      },
      {
        "name": "semantic_grounding_gate",
        "passed": true,
        "detail": "all provided required/optional final GT arguments have auditable provenance",
        "metadata": {
          "source_status": "PROJECT_SEMANTIC_GUARD",
          "parameter_provenance": [
            {
              "turn_id": 0,
              "call_id": 0,
              "function": "ls",
              "parameter": "a",
              "required": false,
              "provided": true,
              "value": false,
              "source_type": "SCHEMA_DEFAULT",
              "source_path": "catalog.ls.parameters.properties.a.default",
              "default_value": false
            },
            {
              "turn_id": 0,
              "call_id": 1,
              "function": "wc",
              "parameter": "file_name",
              "required": true,
              "provided": true,
              "value": "deploy.py",
              "source_type": "PRIOR_TOOL_OUTPUT",
              "leaf_sources": [
                {
                  "source_type": "PRIOR_TOOL_OUTPUT",
                  "source_turn": 0,
                  "source_call": 0,
                  "source_path": "result.current_directory_content[0]"
                }
              ]
            },
            {
              "turn_id": 0,
              "call_id": 1,
              "function": "wc",
              "parameter": "mode",
              "required": false,
              "provided": true,
              "value": "c",
              "source_type": "USER_CONTEXT",
              "source_turns": [
                0
              ],
              "source_path": [
                "turn[0].final_query"
              ],
              "match": "all scalar leaves explicitly mentioned"
            },
            {
              "turn_id": 1,
              "call_id": 0,
              "function": "grep",
              "parameter": "file_name",
              "required": true,
              "provided": true,
              "value": "deploy.py",
              "source_type": "PRIOR_TOOL_OUTPUT",
              "leaf_sources": [
                {
                  "source_type": "PRIOR_TOOL_OUTPUT",
                  "source_turn": 0,
                  "source_call": 0,
                  "source_path": "result.current_directory_content[0]"
                }
              ]
            },
            {
              "turn_id": 1,
              "call_id": 0,
              "function": "grep",
              "parameter": "pattern",
              "required": true,
              "provided": true,
              "value": "update",
              "source_type": "USER_CONTEXT",
              "source_turns": [
                1
              ],
              "source_path": [
                "turn[1].final_query"
              ],
              "match": "all scalar leaves explicitly mentioned"
            },
            {
              "turn_id": 2,
              "call_id": 0,
              "function": "get_user_id",
              "parameter": "user",
              "required": true,
              "provided": true,
              "value": "Catherine",
              "source_type": "USER_CONTEXT",
              "source_turns": [
                2
              ],
              "source_path": [
                "turn[2].final_query"
              ],
              "match": "all scalar leaves explicitly mentioned"
            },
            {
              "turn_id": 2,
              "call_id": 1,
              "function": "send_message",
              "parameter": "receiver_id",
              "required": true,
              "provided": true,
              "value": "USR003",